{
  "$schema": "../scenario.schema.json",
  "id": "healthy-baseline",
  "title": "Healthy baseline",
  "summary": "A steady Contoso Care OLTP mix: front-desk patient lookups, provider schedules, billing balances, check-ins, work-queue triage, supply updates, and audit events. Short, indexed statements with no blocking, used as the baseline activity profile and as the before picture for every incident.",
  "orchestration": "workers",
  "procedure": "demo.usp_scenario_healthy_baseline",
  "duration": { "defaultSeconds": 1800, "maxSeconds": 14400 },
  "concurrency": { "default": 2, "min": 1, "max": 16, "description": "Sessions running the OLTP mix." },
  "intensity": { "default": 3, "min": 1, "max": 10, "description": "Pace: about 1 operation per second per session at 1, about 20 at 10." },
  "targets": {
    "applicable": ["T1", "T2", "T3", "T4"],
    "default": ["T1", "T2", "T3", "T4"],
    "notes": {
      "T3": "Keeps the serverless database awake while it runs; the T3 baseline in activity-profiles.json uses one session at intensity 2.",
      "T4": "The PostgreSQL steps (database/postgresql/120-scenario-functions.sql): the same lookups, a work-item touch, and a tagged audit row; the T4 baseline uses one session at intensity 2."
    }
  },
  "parameters": {},
  "expectedHubSignals": [
    { "signal": "SqlServerPerformanceCountersCommon: Batch Requests/sec and Transactions/sec steady", "surface": "Performance" },
    { "signal": "SqlServerCPUUtilization low and flat", "surface": "Performance" },
    { "signal": "SqlServerActiveSessions: a few ContosoCare.Demo/healthy-baseline sessions, none blocked", "surface": "Performance" },
    { "signal": "No Database Agent finding for the target", "surface": "Database Agent", "note": "Preview; coverage by target is undocumented (ADR 0013)." },
    { "signal": "T4: CPU (cpu_percent) and Connections (active_connections) low and flat", "surface": "Performance", "note": "Database Hub's PostgreSQL dashboard (Azure Monitor metrics; Hub has no query-level data for PostgreSQL)." }
  ],
  "expectedSymptoms": [
    "Short, indexed queries with no blocking and no lock waits",
    "Stable CPU, memory, and IO; Processes blocked stays at 0",
    "A small, bounded number of audit rows written by the workload (trimmed hourly and removed by reset)"
  ],
  "queryLevelEvidence": [
    "Query Store: many short queries with low duration and logical reads",
    "demo.scenario_runs and demo.scenario_run_events record the run, its sessions, and its counters"
  ],
  "reset": "Status changes toggle within their seeded values, so business data stays as seeded; auto-cleanup and reset remove the workload's audit rows."
}
