{
  "$schema": "../scenario.schema.json",
  "id": "slow-consumer",
  "title": "Slow consumer",
  "summary": "A client that fetches a few rows and then pauses: each session runs a wide query (about 1 KB per row) and the runner reads its result set slowly on purpose, so the server fills the network buffers and waits for the client (ASYNC_NETWORK_IO). At the deadline or on a stop request the runner cancels the query, and while the run lasts it runs the query again. The procedure only reads.",
  "orchestration": "slow-consumer",
  "procedure": "demo.usp_scenario_slow_consumer",
  "duration": { "defaultSeconds": 600, "maxSeconds": 1800 },
  "concurrency": { "default": 4, "min": 1, "max": 8, "description": "Sessions whose client reads slowly." },
  "intensity": { "default": 5, "min": 1, "max": 10, "description": "How slowly the client reads: 25 rows, then a pause of about 100 ms at 1 up to 1 second at 10." },
  "targets": {
    "applicable": ["T1", "T2", "T3"],
    "default": ["T3"],
    "notes": {
      "T1": "The runner on the same VM is the client; the wait is the same.",
      "T2": "The runner in the guest is the client; the wait is the same.",
      "T3": "The client is T1's runner, across the network: the usual shape of a slow application against Azure SQL Database."
    }
  },
  "parameters": {
    "rowsPerQuery": { "type": "integer", "default": 100000, "minimum": 1000, "maximum": 500000, "description": "Rows each query returns at most (about 1 KB each).", "sqlParameter": "@rows" }
  },
  "expectedHubSignals": [
    { "signal": "SqlServerWaitStats: Network IO wait category (ASYNC_NETWORK_IO), one long wait per session", "surface": "Performance" },
    { "signal": "SqlServerPerformanceCountersCommon: SQL Attention rate above 0 when the runner cancels a query", "surface": "Performance" },
    { "signal": "SqlServerActiveSessions: the ContosoCare.Demo/slow-consumer sessions running for minutes", "surface": "Performance" }
  ],
  "expectedSymptoms": [
    "ASYNC_NETWORK_IO dominating the waits while the server itself is mostly idle",
    "Long-running requests that do little work: the client, not the server, sets the pace",
    "An attention per cancelled query"
  ],
  "queryLevelEvidence": [
    "sys.dm_exec_requests: wait_type ASYNC_NETWORK_IO on the ContosoCare.Demo/slow-consumer sessions (needs VIEW SERVER STATE or VIEW DATABASE STATE)",
    "The runner's run outcome: rows read, queries, and cancellations per session"
  ],
  "reset": "Read-only: nothing to undo. The runner cancels its queries and closes its sessions; reset kills any that remain."
}
